{"idempotency_key":"idem_synthetic_0001","scope":{"workspace_id":"ws_synthetic_0001","operation":"content.generation.create"},"payload_hash":"sha256:aaaaaaaaaaaaaaaaaaaaaaaaaaaaaaaaaaaaaaaaaaaaaaaaaaaaaaaaaaaaaaaa","state":"in_progress","created_at":"2026-08-31T10:00:00Z","correlation_id":"cor_synthetic_0001"}
